tweet_id,account_name,user_id,timestamp,text,links,repiles,retweets,favorites
1244693710618742784,Rachel Maddow MSNBC,16129920,11:31 AM - 30 Mar 2020,"The number of confirmed coronavirus cases in Florida is doubling every three days. Florida remains one of the few states with a large ,https://www.tampabay.com/news/health/2020/03/28/florida-coronavirus-cases-are-growing-fast-heres-what-that-means/,Null,6970,14620
1244692209300992001,PawanKalyan Devotee !! #VakeelSaab #PSPK26 🔥,921311108505395200,11:25 AM - 30 Mar 2020,Coronavirus ,,Null,19,45
1244687115746754562,Forces News,113646161,11:05 AM - 30 Mar 2020,The British Army is helping convert Glasgow's SEC Centre into a temporary NHS hospital as part of the UK's response to the coronavirus ,https://www.forces.net/news/coronavirus-army-support-glasgow-secs-conversion-temporary-hospital,Null,428,983
1244684365721817089,Andy Ngo,2835451658,10:54 AM - 30 Mar 2020,A man in NYC contacted me. He says he works security at a homeless shelter. Early in ,,Null,1216,3008
1244683237772976128,The Daily Beast,16012783,10:49 AM - 30 Mar 2020,BREAKING: A Florida sheriff announced an arrest warrant for a controversial pastor after the religious leader refused to stop holding packed church services amid the coronavirus ,https://trib.al/GAdPfDE,Null,3038,10856
1244682791297613824,Yamiche Alcindor,89887215,10:47 AM - 30 Mar 2020,.,,Null,3954,21736
1244682779641683969,CBC News Alerts,19038934,10:47 AM - 30 Mar 2020,Ontario premier sidesteps question about pending increase in carbon tax  lavishes praise on Liberal government's handing of coronavirus ,,Null,346,2083
1244682596115779586,Mirror Celeb,55204143,10:47 AM - 30 Mar 2020,Danielle Lloyd braves supermarkets in full protective gear amid coronavirus ,http://mirror.co.uk/3am/celebrity-news/danielle-lloyd-braves-supermarkets-full-21781611,Null,10,64
1244682048457052160,Destiny🖍The🖍Meme,1153430520555905024,10:45 AM - 30 Mar 2020,Yeehaw  ,,Null,599,3306
1244677427390971906,Paul Joseph Watson,18643437,10:26 AM - 30 Mar 2020,Good news.  Italy reports lowest number of new corona cases for 2 weeks.  Imperial College professor says there are signs ,,Null,2959,11770
1244677368658231301,John Solomon,523248016,10:26 AM - 30 Mar 2020,The coronavirus ,https://justthenews.com/politics-policy/coronavirus/trump-time-covid-19-slashing-red-tape-again-he-was-39#.XoIfdBLwlgU.twitter,Null,1343,3390
1244670860746784768,Hatewatch,29770501,10:00 AM - 30 Mar 2020,Despite calls for social distancing to curb the ,https://www.splcenter.org/hatewatch/2020/03/30/neo-confederate-group-moves-ahead-conference-amid-covid-19-outbreak,Null,132,281
1244670673248632838,Press Trust of India,245687754,9:59 AM - 30 Mar 2020,Delhi's Jawaharlal Nehru Stadium to be used as quarantine facility in wake of coronavirus ,,Null,1270,6414
1244668803130236933,Paul Joseph Watson,18643437,9:52 AM - 30 Mar 2020,CBS News is under fire for using footage of the “worst hit” hospital in Bergamo  Italy to illustrate a report about the coronavirus ,https://summit.news/2020/03/30/cbs-news-uses-footage-of-worst-hit-hospital-in-italy-while-describing-new-york-coronavirus-outbreak/,Null,1160,2877
1244663201079361536,The RCN,54506896,9:30 AM - 30 Mar 2020,A reminder of what we’ve been pushing the government for since the ,,Null,20,22
1244660846854385665,Bree Newsome Bass,110326494,9:20 AM - 30 Mar 2020,Yes  people need to stay inside.  Also  it’s a prob that gov’t officials are shifting blame for the death toll completely onto the public when federal & many state  local govts 1st downplayed ,,Null,411,1162
1244659268608880641,Scott Davis,96848521,9:14 AM - 30 Mar 2020,Null,,Null,0,3
1244656974165413888,Ellie Murray,1558406653,9:05 AM - 30 Mar 2020,People seem hungry for information and understanding  not just guidelines. So I’m going to try to talk through the phases of this ,,Null,198,325
1244656522765926400,TO GIVE LIFE IS AN ACT OF GOD, MOTHERS GIVE LIFE!,1183546591417905152,9:03 AM - 30 Mar 2020,Here is the escape goat concerning the C-19 ,,Null,1,3
1244648741979774988,VIN,1285324848,8:32 AM - 30 Mar 2020,Nurses and hospital staff protested outside Jacobi hospital in the Bronx  New York  Sunday  protesting a shortage of medical supplies and federal inaction.  Before: during the ,,Null,10,17
1244648581203734529,Tom Joseph,14542977,8:32 AM - 30 Mar 2020,How did the Trump COVID-19 catastrophe happen? Why does the US have the worst ,https://www.theguardian.com/us-news/2020/mar/28/trump-coronavirus-politics-us-health-disaster,Null,1031,2355
1244647836031074304,ALX 🇺🇸,534023,8:29 AM - 30 Mar 2020,During a Pandemic it is essential that the Media gives us real and accurate information.  It’s completely irresponsible for ,,Null,10514,16177
1244644489806790658,UNICEF Bangladesh,292203151,8:15 AM - 30 Mar 2020,One small change can avert an ,,Null,67,172
1244641756265754624,FOX 5 DC,13918492,8:04 AM - 30 Mar 2020,Null,https://bit.ly/2UOHnl0,Null,290,225
1244641430129315843,PhotoNoTerrorist,53508541,8:03 AM - 30 Mar 2020,A policer officer attempts to stop an accredited member of the press recording an arrest from a safe distance on the beach  ,,Null,112,112
1244639216597757952,Gautam Bhatia,1176552984399867904,7:54 AM - 30 Mar 2020,After the cholera ,,Null,37,124
1244634358343962625,Ryan Struyk,309822757,7:35 AM - 30 Mar 2020,A stark warning from Dr. Birx on the coronavirus ,,Null,1138,3782
1244627698326147074,HHS.gov,44783853,7:09 AM - 30 Mar 2020,Thank you to all the doctors and healthcare professionals who work night and day to care for those in need  especially during the ongoing ,https://bit.ly/2JrCJUY,Null,534,1193
1244625702873436160,Xpress Urgent Care,938215177,7:01 AM - 30 Mar 2020,Null,https://bit.ly/telehealth-ca,Null,30,29
1244623053352394763,Entertainment News,39241047,6:50 AM - 30 Mar 2020,Money Heist Season 4 release date postponed due to global ,http://dlvr.it/RSqvHk,Null,18,54
1244615644298932224,SMF 🇲🇾,321867054,6:21 AM - 30 Mar 2020,hope the virus ,https://twitter.com/501Awani/status/1244247541010448387,Null,240,363
1244607250473406464,Bryan Smith,2827556878,5:47 AM - 30 Mar 2020,Prof Goddard  head of Royal College of Physicians  says 25% NHS doctors are off sick  either testing positive (& in hospital) or self-isolating.  Thats staggering at this stage of UK ,,Null,95,110
1244607055442391040,MRC Centre for Global Infectious Disease Analysis,187503462,5:47 AM - 30 Mar 2020,UPDATE: ,https://imperial.ac.uk/mrc-global-infectious-disease-analysis/COVID-19/,Null,284,354
1244602993976188930,ESPN FC,18091004,5:30 AM - 30 Mar 2020,Lionel Messi says Barcelona players will take a 70% wage cut and support all club staff for as long as the coronavirus ,,Null,2460,14740
1244595445596401670,Global Goals,115099953,5:00 AM - 30 Mar 2020,Zoonotic diseases - transmitted between animals & people  like ,,Null,194,379
1244594713941938176,mariagraziaraciti,514652333,4:57 AM - 30 Mar 2020,Photographer Unknown- A Couple on the Streets of London Wear Masks During the Flu ,,Null,23,31
1244588148161740804,GuntherBett #FBPE 🐟🐟,1153929160961744899,4:31 AM - 30 Mar 2020,Anyone find it odd that criminal Brexit funder Arron Banks 'just happened to disappear to New Zealand" just before the CV19 ,,Null,181,338
1244588125252435969,Nick Turse,171283600,4:31 AM - 30 Mar 2020,Every bit of this is pure gold...  “An Australian astrophysicist has been admitted to hospital after getting four magnets stuck up his nose in an attempt to invent a device that stops people touching their faces during the coronavirus ,https://gu.com/p/dhejy/stw,Null,1449,3396
1244586717916606465,Uncle Blazer,2341440244,4:26 AM - 30 Mar 2020,January 11  2020  China published coronavirus genome allowing tests to be developed. While South Korea was able to roll out widespread testing in early February 2020  Trump’s CDC would be unable to produce a reliable test until late March.,https://www.sciencemag.org/news/2020/01/chinese-researchers-reveal-draft-genome-virus-implicated-wuhan-pneumonia-outbreak,Null,882,1922
1244586714934521857,Uncle Blazer,2341440244,4:26 AM - 30 Mar 2020,July 2019  Trump eliminated a key American public health position in Beijing intended to help detect disease ,https://www.reuters.com/article/us-health-coronavirus-china-cdc-exclusiv-idUSKBN21910S,Null,976,2108
1244586714041024518,Uncle Blazer,2341440244,4:26 AM - 30 Mar 2020,January-August  2019  The Trump Administration ran a pandemic simulation called Crimson Contagion  resulting in a report concluding that the Administration was woefully unprepared for a pandemic  including being short on PPE. Nothing was done to fix it.,https://www.nytimes.com/2020/03/19/us/politics/trump-coronavirus-outbreak.html,Null,1265,2381
1244586710027112453,Uncle Blazer,2341440244,4:26 AM - 30 Mar 2020,February 1  2018  Trump’s CDC announced plans to cut its efforts to fight global pandemics by 80%  scaling back operations in the world’s hot spots for emerging infectious disease  including removing personnel from China.,https://www.washingtonpost.com/news/to-your-health/wp/2018/02/01/cdc-to-cut-by-80-percent-efforts-to-prevent-global-disease-outbreak/,Null,1120,2343
1244586704260005889,Uncle Blazer,2341440244,4:26 AM - 30 Mar 2020,January 11  2017  “Anthony S. Fauci  MD  director of the National Institute of Allergy and Infectious Diseases  said there is ‘no doubt’ Donald J. Trump will be confronted with a surprise infectious disease ,https://www.healio.com/infectious-disease/emerging-diseases/news/online/%7B85a3f9c0-ed0a-4be8-9ca2-8854b2be7d13%7D/fauci-no-doubt-trump-will-face-surprise-infectious-disease-outbreak,Null,975,2331
1244585782540713988,Dr. Dena Grayson,1651522832,4:22 AM - 30 Mar 2020,Null,https://www.washingtonpost.com/world/2020/03/30/coronavirus-latest-news/,Null,1499,2248
1244583715906433024,Sven Groter_3,1026753348744237057,4:14 AM - 30 Mar 2020,Null,,Null,217,394
1244578431058219009,elle🍒샘,55527803,3:53 AM - 30 Mar 2020,Hello! living with a family of doctors  i feel how stressed and depressed they are about this ,,Null,137,332
1244564942013022210,themebambi,1243480870671040519,2:59 AM - 30 Mar 2020,positive news about the coronavirus ,,Null,0,2
1244561890208026626,Leave.EU,3362016513,2:47 AM - 30 Mar 2020,"There has to be a reckoning when all this is over " said a government source.  That's an understatement. China has now re-opened its filthy wet markets that caused the spread of ,,Null,921,2409
1244560493345292289,Box Office India,88147848,2:41 AM - 30 Mar 2020,Amidst ,https://boxofficeindia.co.in/salman-khan-decides-help-25000-daily-wage-workers-financially-film-industry-read-details,Null,386,1679
1244553210955735040,Jean-Marc Pierson,327930255,2:13 AM - 30 Mar 2020,So now we have Jupiter conjunct Pluto (will be exact on the 5th of April)  Is Jupiter bringing medicine  wisdom  knowledge to channel Pluto's ,,Null,63,317
1244552620309712896,EWN Sport,242308246,2:10 AM - 30 Mar 2020,Minister of Sports Nathi Mthethwa has announced a R150 million relief program for  professional athletes  coaches and artists who have had their salaries affected by the ,,Null,15,30
1244549298232217601,NOVO Gazette,4744477719,1:57 AM - 30 Mar 2020,Null,,Null,3,6
1244545759791460354,Kami,1100623948813881344,1:43 AM - 30 Mar 2020,Null,,Null,42,2
1244542393174626305,GetSafeOnline.org,20373332,1:30 AM - 30 Mar 2020,We all have a lot on our minds with the ,,Null,28,27
1244537080207769601,B.H.M.S.,634387992,1:08 AM - 30 Mar 2020,Switzerland lights up famous landmark to bring hope during coronavirus ,https://www.dailymail.co.uk/news/article-8159327/Matterhorn-mountain-lit-stay-home-message-Switzerland.html,Null,10,22
1244536349970976768,Asher Wolf,15486485,1:06 AM - 30 Mar 2020,Employees at home are being photographed every 5 minutes by an always-on video service to ensure they're actually working — and the service is seeing a rapid expansion since the coronavirus ,https://www.businessinsider.com.au/work-from-home-sneek-webcam-picture-5-minutes-monitor-video-2020-3,Null,470,505
1244535656463753216,Bob Ong Quotes,1178663823332347904,1:03 AM - 30 Mar 2020,we dont deserve a walwalan after this covid ,,Null,122,264
1244531632427548672,friedrice engels,939632921954021376,12:47 AM - 30 Mar 2020,even if we pretend that if china acted weeks earlier things could’ve been prevented  well now what? china has capped their infection number at 80k. The rest of the world had the ,,Null,29,227
1244529793351274496,Mark Di Stefano,37881687,12:39 AM - 30 Mar 2020,Rupert Murdoch's Sun running a column dumping on the response to the coronavirus ,,Null,662,1670
1244526012383272961,muhammad.sohaib.5030,1213323128169889792,12:24 AM - 30 Mar 2020,In Pakistan that took away 75 precious lives. As summers begin  mosquito season is upon us and with Pakistan already facing a health crisis due to coronavirus ,,Null,0,3
1244522674098819073,Ezra Cheung,70096587,12:11 AM - 30 Mar 2020,Thousands have started to flood back into Chinese wet markets  with bats  rabbits and dogs  possible culprits for the virus  still on offer. If the ,https://www.news.com.au/lifestyle/health/health-problems/coronavirus-chinese-wet-markets-still-operation-despite-covid19/news-story/104a81601ff7b94fec6dae3e158ad0a1?utm_source=News.com.au&utm_campaign=EditorialSF&utm_medium=Facebook&utm_content=SocialFlow&fbclid=IwAR3fy7HrLVLyrh9TQdy4TkcjjP-ZuhoDNK6_ufTzj3Mn0U0Z0LpRnlvMN0o,Null,509,650
1244522109499555840,Samira Sawlani,348620338,12:09 AM - 30 Mar 2020,Some much needed positive news on the Ebola front in the DRC. It’s 41 days without a new case!  (National hero & the man who discovered the disease  Dr. Jean-Jacques Muyembe  has said if things continue this way the 12th April will be the date the ,,Null,167,406
1244521305074020354,Adil Faraz khan,1141742094157078529,12:06 AM - 30 Mar 2020,If You Have Been Planning To Visit ,,Null,3,40
1244517230433513478,RATCHET LOMBAX,4836404739,11:50 PM - 29 Mar 2020,Good morning guys I woke up 20 minutes ago and still feel sleepy. I have turned on the TV and saw captain Qwark on national channel  talking about the virus ,,Null,1,6
1244507028648873984,STV News,20132853,11:09 PM - 29 Mar 2020,Supermarket chain Morrisons has pledged to donate £10m worth of groceries to help restock the country's food banks during the coronavirus ,https://news.stv.tv/scotland/morrisons-to-restock-food-banks-with-10m-worth-of-groceries,Null,454,3068
1244505902130003968,Riot,3322582110,11:05 PM - 29 Mar 2020,Null,,Null,66,11
1244497154049077248,Imam of Peace,1583865109,10:30 PM - 29 Mar 2020,Null,,Null,27308,64219
1244493066830073857,Moonborn 🌕,15743628,10:14 PM - 29 Mar 2020,Roses are red Violets are blue Ending this ,,Null,29,59
1244491024191365120,Hamza Shaban,391560579,10:05 PM - 29 Mar 2020,“An Australian astrophysicist has been admitted to hospital after getting four magnets stuck up his nose in an attempt to invent a device that stops people touching their faces during the coronavirus ,https://www.theguardian.com/australia-news/2020/mar/30/astrophysicist-gets-magnets-stuck-up-nose-while-inventing-coronavirus-device,Null,232,492
1244487185627320320,Mike Danesh,1170199328016805888,9:50 PM - 29 Mar 2020,Monday news about the ,,Null,43,111
1244479327195955200,#ProudBharatiye!,1545279336,9:19 PM - 29 Mar 2020,An 85yrs old Saint  who devoted his entire life for the service of Hinduism  was awarded life sentence  and even denied bail for 6yrs. Considering his age and services ,,Null,22,26
1244463117569941504,Wilson Leung 梁允信 🇭🇰,1140607324127518720,8:15 PM - 29 Mar 2020,"An American walking w a group of foreigners in Beijing saw a woman grab her child and run the other way. Others have described being called 'foreign trash'. A recent article was headlined: 'Beware of second ,https://www.theguardian.com/world/2020/mar/29/china-coronavirus-anti-foreigner-feeling-imported-cases?CMP=Share_AndroidApp_Tweet,Null,451,645
1244461848168214533,news.com.au,15250661,8:10 PM - 29 Mar 2020,Thousands of people have started to flood back into Chinese wet markets  with bats  rabbits and dogs still on offer despite the coronavirus ,https://www.news.com.au/lifestyle/health/health-problems/coronavirus-chinese-wet-markets-still-operation-despite-covid19/news-story/104a81601ff7b94fec6dae3e158ad0a1,Null,480,435
1244453808266076160,Joshua Wong 黃之鋒 😷,18798768,7:38 PM - 29 Mar 2020,1.2/ More importantly  praising the superiority of China over the western liberal democracies. This narrative is tightly connected to President Xi Jinping's personality cult  as his authority has been deeply challenged since the ,,Null,143,462
1244448006868361217,TIMES NOW,240649814,7:15 PM - 29 Mar 2020,Religious discrimination continues in Pakistan amid COVID-19 ,https://www.timesnownews.com/international/article/religious-discrimination-continues-in-pakistan-amid-covid-19-outbreak-hindus-denied-food-supplies-in-karachi/571137,Null,564,848
1244441597519040512,Kambree,3995778614,6:49 PM - 29 Mar 2020,A bombshell report reveals that the Obama-Biden Administration ignored at least 3 government reports in which "federal officials predicted the United States would experience a critical lack of ventilators" during an ,,Null,3310,5563
1244441153694388225,Cernovich,358545917,6:47 PM - 29 Mar 2020,People have asked for pictures  well here you go  Flu Crew.  May God have mercy on you for your recklessness.,https://www.buzzfeednews.com/article/miriamelder/coronavirus-new-york-city-hospital-nurse-covid-19-deaths,Null,254,619
1244431944772988935,Juicy,1234315579122733058,6:11 PM - 29 Mar 2020,Many children in Afghanistan will likely have to work outside despite the COVID19 ,https://www.gofundme.com/f/ruqywj-helping-orphans?sharetype=teams&member=4108140&pc=fb_tco_campmgmtbnr_m&rcid=r01-158551177575-e2438ce69d31420b&utm_source=facebook&utm_medium=social&utm_campaign=p_lico%2Bbanner&fbclid=IwAR27jMoAV1bhyb22geLzQWLXh_C7wNYTx1RSu9pEro3WujRdihTjznjnQf8,Null,93,98
1244418158255095808,Lee Camp [Redacted],19580890,5:16 PM - 29 Mar 2020,What if we divided ourselves into the working class & the ultra rich rather than dividing up by nations?  Ask yourself: Do I despise a Chinese shoe salesman struggling to feed his family? Or a Venezuelan garbage collector? Why am I told to hate them?,https://consortiumnews.com/2020/03/27/lee-camp-an-idea-we-take-for-granted-has-made-the-outbreak-much-worse/,Null,317,654
1244416386971193345,Kyle Orton,544732668,5:09 PM - 29 Mar 2020,Null,,Null,700,710
1244410643077185536,Donald Leung,898563992892850177,4:46 PM - 29 Mar 2020,Red China has exported the ,,Null,4,23
1244406195034693635,Sidney Powell 🇺🇸⭐⭐⭐,586707638,4:28 PM - 29 Mar 2020,This is insane!  ,https://jonathanturley.org/2020/03/29/washington-state-prohibits-citizens-from-fishing-cites-corona-virus-outbreak/,Null,107,182
1244403471773827072,stay home 🇳🇬,26010290,4:18 PM - 29 Mar 2020,it’s crazy that life as we knew it will never go back to how it was after this this ,,Null,72,317
1244401836485984257,Jefferson,4892685173,4:11 PM - 29 Mar 2020,Supermarket chain Morrisons  the UK's largest fresh food manufacturer  is to ramp up production at its 14 sites and distribute £10 million worth of produce to food banks across the country during the coronavirus ,,Null,310,710
1244399799790600194,CEO BAD aka Lord X (snapchat; lordxboxone),51094772,4:03 PM - 29 Mar 2020,She’s right tho Why put 5g signal towers around London and other cities & towns at a time of the Virus ,,Null,192,314
1244398082139328514,Yamiche Alcindor,89887215,3:56 PM - 29 Mar 2020,President Trump is now lashing out at ,,Null,11417,53460
1244394304233144320,ً,1197349007376433152,3:41 PM - 29 Mar 2020,music execs supposedly wanted abel to postpone the release of after hours due to the ,,Null,181,818
1244392551689457665,CNN Breaking News,428333,3:34 PM - 29 Mar 2020,President Trump extends federal guidelines for social distancing through April 30 because of the coronavirus ,https://cnn.it/3bGgTJv,Null,741,1485
1244389974969126915,Y.N.M.S,1128337957289697281,3:24 PM - 29 Mar 2020,Syrian army units in Idlib receive massive medical masks to prevent coronavirus ,,Null,14,44
1244389792491634688,Darren Puscas,309311440,3:23 PM - 29 Mar 2020,Trump is seriously is surprised by every new ,,Null,98,689
1244381660558262274,John Burn-Murdoch,43878033,2:51 PM - 29 Mar 2020,Plenty of things _indirectly related to population_ can make a difference: • Pop density can increase rate of spread • Countries with many major travel hubs may end up with multiple ,,Null,109,654
1244381296408829961,Kenneth The Slide Guy,1243921661537202176,2:49 PM - 29 Mar 2020,100 years from now when the next pandemic hits  there’s going to be a graph of the 2020 COVID-19 ,,Null,6,63
1244367903555751937,Waqas,20927739,1:56 PM - 29 Mar 2020,Not saying much but  3G Network launched in 2002/03  SARS ,,Null,9,24
1244357427736305667,Engin Dikmen #EvdeKal,90272103,1:15 PM - 29 Mar 2020,Null,,Null,2,3
1244355899986259970,PragerU,41160276,1:09 PM - 29 Mar 2020,Gun sales are SURGING in the midst of the ,,Null,158,467
1244353180122701825,Ms. Krassenstein,963790885937995777,12:58 PM - 29 Mar 2020,Remember that time during the Ebola ,,Null,1137,2817
1244351465357008896,Stephanie Ruhle,382685028,12:51 PM - 29 Mar 2020,Four dead on Carnival cruise ship amid new coronavirus ,https://www.cnbc.com/2020/03/27/four-dead-on-carnival-cruise-ship-amid-new-coronavirus-outbreak-aboard.html,Null,714,1152
1244343422506262528,Xpose Trophy Hunting,1602679219,12:19 PM - 29 Mar 2020,Wet markets selling animals butchered in front of shoppers are open across Asia despite blame for starting the coronavirus ,https://www.thesun.co.uk/news/11271765/coronavirus-wet-markets-still-selling/,Null,397,376
1244342989322956803,OperationFreeAssange,1090816815574466561,12:17 PM - 29 Mar 2020,Null,,Null,183,226
1244341824766070784,#RIPGOP ™ 🏳️‍🌈,996157289026473985,12:13 PM - 29 Mar 2020,Null,https://www.buzzfeednews.com/article/miriamelder/coronavirus-new-york-city-hospital-nurse-covid-19-deaths,Null,7,10
1244341758193958914,Israel Foreign Ministry,85796380,12:12 PM - 29 Mar 2020,Watch the ,,Null,119,196
1244339796597780482,ADELEKE IFEOLUWA,2150965883,12:05 PM - 29 Mar 2020,Aunty kemi is on point.....I knew the speech was prerecorded    Nigeria is in serious mess with the way this man is handling this Coronavirus ,,Null,1,9
1244328931135717376,RebeckaGenie,1226974186326970370,11:21 AM - 29 Mar 2020,Everyone is watching pandemic movies like ,,Null,0,3
1244328467816239104,Muhammadu Buhari,2936714848,11:19 AM - 29 Mar 2020,I want to assure you all that ,,Null,194,428
1244326425135665158,Stephanie Grisham,818927131883356161,11:11 AM - 29 Mar 2020,.,,Null,4381,13935
1244324983519805442,NCDC,705694814612938752,11:06 AM - 29 Mar 2020,President ,,Null,1335,3933
1244319661123973122,Sky News,7587032,10:45 AM - 29 Mar 2020,Kate Winslet starred in the film Contagion about a hypothetical virus ,https://trib.al/8wQG3tb,Null,1904,4315
1244319332932468739,Yusuf / Cat Stevens,212187460,10:43 AM - 29 Mar 2020,The last prophet Muhammad ﷺ said: "If you hear of an ,,Null,575,1945
1244312813247455232,ᎠᏌNᎬᎷYᎢᎻᎪNᏩ™️,32522055,10:17 AM - 29 Mar 2020,“The nurse described a horrific Catch-22. “If we are covid positive  we are expected to work for as long as we are asymptomatic. However we cannot get tested unless we are symptomatic”  I can’t believe what we’re asking of our nurses and doctors ,https://www.buzzfeednews.com/article/miriamelder/coronavirus-new-york-city-hospital-nurse-covid-19-deaths,Null,327,456
1244309311427411974,Julia Ioffe,71048726,10:03 AM - 29 Mar 2020,I have no words to describe how crushing this piece by ⁦,https://www.buzzfeednews.com/article/miriamelder/coronavirus-new-york-city-hospital-nurse-covid-19-deaths,Null,937,1314
1244309107097600002,Maggie Haberman,93069110,10:03 AM - 29 Mar 2020,Walking around a hospital parking lot to show things aren't that bad belies the reality inside  as these photos show > ,https://www.buzzfeednews.com/article/miriamelder/coronavirus-new-york-city-hospital-nurse-covid-19-deaths,Null,2417,3875
1244307344886022144,Justin,4269393803,9:56 AM - 29 Mar 2020,Mike Bloomberg spent nearly $1 billion running for President with the slogan “Mike will get it done.”  Since the ,,Null,3244,13873
1244301541990776832,Robert F. Kennedy Jr,337808606,9:33 AM - 29 Mar 2020,Scientists are tracing path of Sars-CoV-2 from a wild animal host—but we need to look at the part played in the ,https://www.theguardian.com/world/2020/mar/28/is-factory-farming-to-blame-for-coronavirus,Null,199,425
1244300102539370498,Anthony N. Morgan,1594177002,9:27 AM - 29 Mar 2020,“This is not about race!”,,Null,28,83
1244290919890903042,Miriam Elder,18295206,8:50 AM - 29 Mar 2020,He said at his hospital they were expected to use PPE for *five days* before changing out. "They don’t want to test us because  at the rates we are exposed  we are likely all sick and we don’t know it” ,https://www.buzzfeednews.com/article/miriamelder/coronavirus-new-york-city-hospital-nurse-covid-19-deaths,Null,250,308
1244290303189803009,Miriam Elder,18295206,8:48 AM - 29 Mar 2020,A nurse sent me a tragic photo showing the scale of this coronavirus crisis. He wanted people to see "the ghastly reality of what we deal with” ,https://www.buzzfeednews.com/article/miriamelder/coronavirus-new-york-city-hospital-nurse-covid-19-deaths,Null,1551,1584
1244290101036736514,Charlie Kirk,292929271,8:47 AM - 29 Mar 2020,Did you know:  Since the beginning of the China Virus ,,Null,5032,16945
1244287931080159234,@EsperDoD,1142185061439197186,8:38 AM - 29 Mar 2020,False statements of U.S. service members causing the ,https://www.defense.gov/Explore/Spotlight/Coronavirus/Rumor-Control/,Null,653,1435
1244284205565202432,Ellie Murray,1558406653,8:24 AM - 29 Mar 2020,If you’d never heard of epidemiology before ,,Null,1771,7826
